product_id,product_url,ingredients,ok,error
206,https://www.oliveyoung.co.kr/store/goods/getGoodsDetail.do?goodsNo=A000000188087&dispCatNo=100000100010014&trackingCd=Cat100000100010014_Small&t_page=카테고리관&t_click=에센스/세럼/앰플_전체__상품상세&t_number=206,"정제수, 아스코빅애씨드(200,000ppm), 프로판다이올, 부틸렌글라이콜, 다이프로필렌글라이콜, 사이클로펜타실록세인, 사이클로헥사실록세인, 소듐하이드록사이드, 1,2-헥산다이올, 글루타티온, 페룰릭애씨드, 베타-글루칸, 토코페롤, 판테놀, 소듐아스코빌포스페이트, 베타-카로틴, 나이아신아마이드, 피리독신, 폴릭애씨드, 바이오틴, 사이아노코발아민, 티아민에이치씨엘, 리보플라빈, 리놀레익애씨드, 알파-비사보롤, 로즈힙열매오일, 아데노신, 해바라기씨오일, 글리세린, 솔비톨, 소듐하이알루로네이트, 하이알루로닉애씨드, 소듐하이알루로네이트크로스폴리머, 하이드롤라이즈드소듐하이알루로네이트, 하이드롤라이즈드하이알루로닉애씨드, 소듐아세틸레이티드하이알루로네이트, 하이드록시프로필트라이모늄하이알루로네이트, 알란토인, 필리핀오렌지껍질추출물, 솔잣나무잎/줄기추출물, 서양송악잎/줄기추출물, 베르가모트오일, 양까막까치밥나무잎추출물, 리씨열매오일, 에틸헥실글리세린, C12-14알케스-12, t-부틸알코올, 하이드로제네이티드레시틴, 폴리글리세릴-10스테아레이트, 수크로오스스테아레이트, 카프릴릭/카프릭트라이글리세라이드, 글리세릴스테아레이트, 소듐스테아로일글루타메이트, 소듐폴리아크릴로일다이메틸타우레이트, 폴리아크릴레이트크로스폴리머-6, 다이메티콘/비닐다이메티콘크로스폴리머, 잔탄검, 다이소듐이디티에이",True,
207,https://www.oliveyoung.co.kr/store/goods/getGoodsDetail.do?goodsNo=A000000223183&dispCatNo=100000100010014&trackingCd=Cat100000100010014_Small&t_page=카테고리관&t_click=에센스/세럼/앰플_전체__상품상세&t_number=207,"정제수, 글리세린, 부틸렌글라이콜, 다이프로필렌글라이콜, 1,2-헥산다이올, 나이아신아마이드, 트레할로오스, 판테놀, 알지닌, 카보머, 베타인, 소듐하이알루로네이트(660,000ppb),에틸헥실글리세린, 시트릭애씨드, 아데노신, 자일리틸글루코사이드, 안하이드로자일리톨, 약모밀추출물, 다이소듐이디티에이, 글리세릴아크릴레이트/아크릴릭애씨드코폴리머, 자일리톨, 잔탄검, 소듐시트레이트, 글루코오스, 락토바실러스발효용해물, 베타-글루칸, 검은귀리추출물, 레시틴, 하이드록시프로필트라이모늄하이알루로네이트(1000ppb), 포타슘솔베이트, 소듐아세틸레이티드하이알루로네이트(100ppb), 하이드롤라이즈드하이알루로닉애씨드 (100ppb), 폴리글리세릴-10라우레이트, 폴리글리세릴-4라우레이트, 하이알루로닉애씨드(25ppb), 카프릴릴/카프릴글루코사이드, 소듐하이알루로네이트크로스폴리머(10ppb), 포타슘하이알루로네이트(2ppb)",True,
208,https://www.oliveyoung.co.kr/store/goods/getGoodsDetail.do?goodsNo=A000000172041&dispCatNo=100000100010014&trackingCd=Cat100000100010014_Small&t_page=카테고리관&t_click=에센스/세럼/앰플_전체__상품상세&t_number=208,"[1제]정제수,부틸렌글라이콜,글리세린,피이지-40캐스터오일,하이드로제네이티드레시틴,카프릴릭/카프릭트라이글리세라이드,돌콩스테롤,1,2-헥산다이올,하이드록시데실유비퀴논,리모넨,베르가모트오일,토코페릴아세테이트,리날룰,시트랄 [2제]정제수,부틸렌글라이콜,갈락토미세스발효여과물,글리세린,나이아신아마이드,1,2-헥산다이올,요엽후박나무껍질추출물,판테놀,락토바실러스발효물,병풀추출물,암모늄아크릴로일다이메틸타우레이트/브이피코폴리머,소듐하이알루로네이트,페녹시에탄올,찔레꽃열매추출물,비자나무추출물,죽절초추출물,산딸나무추출물,파초추출물,프로판다이올,에틸헥실글리세린,피브이엠/엠에이코폴리머,소듐폴리아크릴레이트,소듐하이알루로네이트크로스폴리머,아데노신,셀룰로오스검,하이드롤라이즈드글라이코사미노글리칸,폴리쿼터늄-51,서양산딸기추출물,로우스위트블루베리추출물,아사이팜열매추출물,폴리글루타믹애씨드,크랜베리추출물,빌베리열매추출물,라즈베리추출물,비치스트로베리추출물,흰목이버섯포자낭과추출물,벤질글라이콜,카프릴릴글라이콜,하이드롤라이즈드하이알루로닉애씨드,소듐디엔에이,펜틸렌글라이콜,하이드로제네이티드레시틴,소듐포스페이트,아세틸헥사펩타이드-8,락토바실러스/호밀가루발효물,락토바실러스/소이밀크발효여과물,바실러스/소이빈발효추출물,소듐클로라이드,퉁퉁마디추출물,팔미토일테트라펩타이드-7,가시오가피추출물,맥문동뿌리추출물,하이알루로닉애씨드,팔미토일트라이펩타이드-1,라즈베리케톤,카보머,아텔로콜라겐,데사미도콜라겐,사과추출물,폴리솔베이트20,소듐락테이트,하이드롤라이즈드콜라겐,알에이치-올리고펩타이드-1,수용성콜라겐,소듐아세틸레이티드하이알루로네이트,콜라겐,콜라겐아미노산,블랙체리열매추출물,판토테닉애씨드,폴릭애씨드,피리독신,티아민에이치씨엘,프로콜라겐,에스에이치-올리고펩타이드-5,사이아노코발아민,리보플라빈",True,
209,https://www.oliveyoung.co.kr/store/goods/getGoodsDetail.do?goodsNo=A000000201152&dispCatNo=100000100010014&trackingCd=Cat100000100010014_Small&t_page=카테고리관&t_click=에센스/세럼/앰플_전체__상품상세&t_number=209,"정제수, 글리세린, 다이프로필렌글라이콜, 스쿠알란, 메틸트라이메티콘, 1,2-헥산다이올, 판테놀, 부틸렌글라이콜, 알라닐글루타민, 비스-피이지-18메틸에터다이메틸실레인, 카프릴릭/카프릭트라이글리세라이드, 에이치디아이/트라이메틸올헥실락톤크로스폴리머, C14-22알코올, 해바라기씨오일, 다이메티콘, 트레할로오스, 토코페릴아세테이트, 글리세릴스테아레이트, 암모늄아크릴로일다이메틸타우레이트/브이피코폴리머, C12-20알킬글루코사이드, 베헤네스-20, 피이지-100스테아레이트, 알란토인, 트로메타민, 펜틸렌글라이콜, 폴리아크릴레이트-13, 락토바실러스/콩발효추출물, 3-O-에틸아스코빅애씨드, 다이포타슘글리시리제이트, 엑토인, 아크릴레이트/C10-30알킬아크릴레이트크로스폴리머, 효모/감자추출물발효여과물, 4-T-부틸사이클로헥산올, 마카다미아씨오일, 트라이에틸헥사노인, 하이드로제네이티드폴리아이소부텐, 효모/보리씨발효여과물, 하이드로제네이티드레시틴, 아데노신, 아라키딜글루코사이드, 시어버터, 소듐하이알루로네이트, 잔탄검, 돌콩오일, 육두구추출물, 트라이소듐이디티에이, 베타-글루칸, 실리카, 레티놀, 글리세릴베헤네이트, 폴리솔베이트20, 폴리글리세릴-10라우레이트, 에틸헥실팔미테이트, 소듐메타바이설파이트, 스테아릭애씨드, 트록세루틴, 비에이치티, 카보머, 세라마이드엔피, 콜레스테롤, 솔비탄아이소스테아레이트, 알지닌, 글루타믹애씨드, 펜타에리스리틸테트라-다이-T-부틸하이드록시하이드로신나메이트, 폴리카프로락톤, 폴록사머188, 폴리솔베이트60, 세틸팔미테이트, 글리세릴다이스테아레이트, 미리스틸미리스테이트, 소듐스테아로일글루타메이트, 소듐아스코빌포스페이트, 메톡시피이지-12레틴아마이드, 다이메틸아이소소바이드, 베타-카로틴, 당근추출물, 당근씨오일, 토코페롤, 에탄올, 소듐설파이트, 글라이신, 트리스(테트라메틸하이드록시피페리딘올)시트레이트, 하이드록시피나콜론레티노에이트, 카퍼트라이펩타이드-1, 아세틸헥사펩타이드-8, 카프릴릴글라이콜, 로즈마리잎오일, 베티버뿌리오일, 리모넨",True,
210,https://www.oliveyoung.co.kr/store/goods/getGoodsDetail.do?goodsNo=A000000231293&dispCatNo=100000100010014&trackingCd=Cat100000100010014_Small&t_page=카테고리관&t_click=에센스/세럼/앰플_전체__상품상세&t_number=210,"정제수, 부틸렌글라이콜, 글리세린, 메틸글루세스-20, 아스코빌글루코사이드, 나이아신아마이드, 카프릴릴메티콘, 카프릴릭/카프릭트라이글리세라이드, 하이드로제네이티드폴리아이소부텐, 1,2-헥산다이올, 트로메타민, 하이드록시에틸아크릴레이트/소듐아크릴로일다이메틸타우레이트코폴리머, 폴리솔베이트20, 폴리아크릴레이트-13, 다이메티콘, 판테놀, 소듐스테아로일글루타메이트, 소듐시트레이트, 폴리아이소부텐, 폴리아크릴레이트크로스폴리머-6, 다이메틸아이소소바이드, 락토바실러스/콩추출물발효여과물, 해바라기씨오일, 옥수수전분, 돌콩오일, 만니톨, 수크로오스, 마이크로크리스탈린셀룰로오스, 글리세릴카프릴레이트, 스핑고모나스발효추출물, 에틸헥실글리세린, 솔비탄아이소스테아레이트, 소듐메타포스페이트, 당근추출물, 아데노신, 하이드록시피나콜론레티노에이트, 시트릭애씨드, 레티놀, 티타늄디옥사이드 (CI 77891), 황색산화철, 엑토인, 하이드로제네이티드레시틴, 아스코빅애씨드, 베타-카로틴, 토코페롤, 펜틸렌글라이콜, 프로필렌글라이콜, 소듐하이알루로네이트, 카보머, 아세틸테트라펩타이드-11, 아라비아고무나무검, 프로필렌글라이콜알지네이트",True,
211,https://www.oliveyoung.co.kr/store/goods/getGoodsDetail.do?goodsNo=A000000239651&dispCatNo=100000100010014&trackingCd=Cat100000100010014_Small&t_page=카테고리관&t_click=에센스/세럼/앰플_전체__상품상세&t_number=211,"정제수, 프로판다이올, 부틸렌글라이콜, 메틸글루세스-20, 글리세린, 1,2-헥산다이올, 락토바실러스발효물, 락틱애씨드/글라이콜릭애씨드코폴리머(10ppm), 하이드롤라이즈드콜라겐, 소듐하이알루로네이트크로스폴리머, 소듐하이알루로네이트, 하이드록시아파타이트, 레스베라트롤, 아세틸헥사펩타이드-8, 아세틸헥사펩타이드-1, 헥사펩타이드-2, 아스코빅애씨드폴리펩타이드, 팔미토일테트라펩타이드-7, 아세틸옥타펩타이드-3, 아세틸테트라펩타이드-2, 아세틸테트라펩타이드-3, 아세틸테트라펩타이드-5, 아세틸테트라펩타이드-9, 아세틸다이펩타이드-1세틸에스터, 팔미토일트라이펩타이드-1, 팔미토일펜타펩타이드-4, 팔미토일트라이펩타이드-5, 카퍼트라이펩타이드-1, 노나펩타이드-1, 바이오틴, 아데노신, 세라마이드엔피, 베타-글루칸, 토코페롤, 판테놀, 베타인, 프룩토올리고사카라이드, 프룩탄, 이눌린, 폴리솔베이트20, 카르노신, 카프릴릴글라이콜, 소듐락테이트, 다이펩타이드다이아미노부티로일벤질아마이드다이아세테이트, 솔비탄라우레이트, 아가, 허니로커스트씨추출물, 펜틸렌글라이콜, 글리세릴폴리메타크릴레이트, 풀루란, C12-14알케스-12, 하이드록시에틸셀룰로오스, 트로메타민, 폴리아크릴레이트크로스폴리머-6, 카프릴릭/카프릭트라이글리세라이드, 에틸헥실글리세린, 하이드로제네이티드레시틴, 소듐파이테이트, 칼슘알지네이트, 암모늄아크릴로일다이메틸타우레이트/브이피코폴리머, 아크릴레이트/C10-30알킬아크릴레이트크로스폴리머, 만니톨, 글리세릴카프릴레이트, 카보머, 마이카 (CI 77019), 티타늄디옥사이드 (CI 77891), 잔탄검, 향료",True,
212,https://www.oliveyoung.co.kr/store/goods/getGoodsDetail.do?goodsNo=A000000174751&dispCatNo=100000100010014&trackingCd=Cat100000100010014_Small&t_page=카테고리관&t_click=에센스/세럼/앰플_전체__상품상세&t_number=212,"정제수, 글리세린, 부틸렌글라이콜, 1,2-헥산다이올, 카프릴릭/카프릭트라이글리세라이드, 판테놀, 세라마이드엔피, 세라마이드엔에스, 세라마이드에이에스, 세라마이드이오피, 세라마이드에이피, 마트리카리아잎추출물, 녹차추출물, 타임추출물, 애플민트잎추출물, 알란토인, 소듐하이알루로네이트, 트레할로오스, 수크로오스, 콜레스테롤, 글리세레스-26, C14-22알코올, C12-20알킬글루코사이드, 피브이엠/엠에이코폴리머, 아크릴레이트/C10-30알킬아크릴레이트크로스폴리머, 글리세릴아크릴레이트/아크릴릭애씨드코폴리머, 하이드로제네이티드레시틴, 트로메타민, 토코페롤, 잇꽃꽃추출물, 바오밥나무씨오일, 잔탄검, 스테아릭애씨드, 다이소듐이디티에이, 에틸헥실글리세린",True,
213,https://www.oliveyoung.co.kr/store/goods/getGoodsDetail.do?goodsNo=A000000213618&dispCatNo=100000100010014&trackingCd=Cat100000100010014_Small&t_page=카테고리관&t_click=에센스/세럼/앰플_전체__상품상세&t_number=213,"정제수, 글리세린, 부틸렌글라이콜, 베타인, 나이아신아마이드(30,000 ppm), 1,2-헥산다이올, 메틸프로판다이올, 인도멀구슬나무꽃추출물, 홀리바질잎추출물, 인도멀구슬나무잎추출물, 울금뿌리추출물, 참산호말추출물, 소듐하이알루로네이트, 하이드롤라이즈드하이알루로닉애씨드, 카카오추출물, 하이알루로닉애씨드, 판테놀(5,000 ppm), 폴리글리세릴-10라우레이트, 하이드로제네이티드레시틴, 암모늄아크릴로일다이메틸타우레이트/브이피코폴리머, 트로메타민, 카프릴릭/카프릭트라이글리세라이드, 에틸헥실글리세린, 프로판다이올, 아데노신, 소듐하이알루로네이트크로스폴리머, 토코페롤(200 ppm), 폴리글리세릴-10올리에이트, 하이드롤라이즈드글라이코사미노글리칸, 3-O-에틸아스코빅애씨드(100 ppm), 소듐파이테이트, 아스코빅애씨드(50 ppm), 세라마이드엔피, 벤질글라이콜, 베타-글루칸, 덱스트린, 카프릴로일살리실릭애씨드, 글루코노락톤, 카보머, 잔탄검, 향료",True,
214,https://www.oliveyoung.co.kr/store/goods/getGoodsDetail.do?goodsNo=A000000224110&dispCatNo=100000100010014&trackingCd=Cat100000100010014_Small&t_page=카테고리관&t_click=에센스/세럼/앰플_전체__상품상세&t_number=214,"락토바실러스발효용해물(바이오-피디알엔TM)@정제수@프로판다이올@글리세린@나이아신아마이드@부틸렌글라이콜@카페인@다이프로필렌글라이콜@1,2-헥산다이올@다이에톡시에틸석시네이트@글리세릴폴리메타크릴레이트@폴리아크릴레이트크로스폴리머-6@만니톨@에틸헥실글리세린@아데노신@소듐시트레이트@덱스트린@카카오추출물@시트릭애씨드@다이소듐이디티에이@T-부틸알코올@알지닌@사이클로덱스트린@하이드록시프로필사이클로덱스트린@말토덱스트린@잔탄검@베타-글루칸@아세틸테트라펩타이드-11@토코페롤",True,
215,https://www.oliveyoung.co.kr/store/goods/getGoodsDetail.do?goodsNo=A000000229494&dispCatNo=100000100010014&trackingCd=Cat100000100010014_Small&t_page=카테고리관&t_click=에센스/세럼/앰플_전체__상품상세&t_number=215,"정제수, 부틸렌글라이콜, 스쿠알란, 메틸트라이메티콘, 글리세린, 비스-하이드록시에톡시프로필다이메티콘, 1,2-헥산다이올, 락토바실러스발효용해물, C14-22알코올, 시어버터, 팔미틱애씨드, 해바라기씨오일, 스테아릭애씨드, 글리세릴스테아레이트, 피이지-100스테아레이트, 하이드록시에틸아크릴레이트/소듐아크릴로일다이메틸타우레이트코폴리머, 다이메틸아이소소바이드, C12-20알킬글루코사이드, 돌콩오일, 카보머, 만니톨, 당근추출물, 글리세릴카프릴레이트, 트로메타민, 다이소듐이디티에이, 코질메틸렌다이옥시신나메이트, 에틸헥실글리세린, 펜틸렌글라이콜, 잔탄검, 마데카소사이드, 하이드록시피나콜론레티노에이트, 솔비탄아이소스테아레이트, 레티놀, 트레할로오스, 베타-카로틴, 토코페롤, 비에이치티, 아라비아고무나무검, 아세틸테트라펩타이드-11, 하이드로제네이티드포스파티딜콜린, 편백잎추출물, 데카펩타이드-4, 소듐올리에이트, 프로필렌글라이콜알지네이트, 벼에스에이치-올리고펩타이드-1 * 레티놀 함량 509 IU/g",True,
216,https://www.oliveyoung.co.kr/store/goods/getGoodsDetail.do?goodsNo=A000000160531&dispCatNo=100000100010014&trackingCd=Cat100000100010014_Small&t_page=카테고리관&t_click=에센스/세럼/앰플_전체__상품상세&t_number=216,"-하이드라 크림앰플(30ml) 코코넛야자열매수,부틸렌글라이콜,글리세린,정제수,카프릴릭/카프릭트라이글리세라이드,폴리글리세릴-10스테아레이트,소듐하이 알루로네이트,바오밥나무씨추출물,펜타에리스리틸테트라에틸헥사노에이트,세테아릴알코올,알로에베라잎추출물,시어버터,1,2-헥산다이올,접시꽃추출물,드럼스틱씨오일,비피다발효여과물,락토코쿠스발효물,락토바실러스발효물,자이언트켈프추출물,하이알루로닉애씨드,하이드록시프로필트라이모늄하이알루로네이트,하이드롤라이즈드하이알루로닉애씨드,하이드롤라이즈드소듐하이알루로네이트,소듐아세틸레이티드하이알루로네이트,하이드롤라이즈드글라이코사미노글리칸,소듐하이알루로네이트크로스폴리머,다이메틸실란올하이알루로네이트,포타슘하이알루로네이트,카프릴릴글라이콜,펜틸렌글라이콜,스페인감초뿌리추출물,루이보스추출물,카보머,알지닌,하이드로제네이티드레시틴,잔탄검,알란토인,다이포타슘글리시리제이트,에틸헥실글리세린,소엽잎추출물,몰약수지추출물,모하비유카뿌리추출물",True,
217,https://www.oliveyoung.co.kr/store/goods/getGoodsDetail.do?goodsNo=A000000224398&dispCatNo=100000100010014&trackingCd=Cat100000100010014_Small&t_page=카테고리관&t_click=에센스/세럼/앰플_전체__상품상세&t_number=217,"[유세린 이븐래디언스 일루미네이팅 세럼 30ml] 정제수,글리세린,변성알코올,세틸알코올,다이부틸아디페이트,카프릴릭/카프릭트라이글리세라이드,다이카프릴릴카보네이트,프로필헵틸카프릴레이트,페녹시에탄올,에틸헥실글리세린,다이메티콘,향료,소듐하이알루로네이트,카보머,트라이소듐이디티에이,아이소부틸아미도티아졸릴레조시놀,소듐스테아로일글루타메이트,소듐하이드록사이드,소듐클로라이드,토코페롤 [유세린 하이알루론 쓰리엑스 나이트크림 7ml] 정제수,글리세린,시어버터,아이소프로필팔미테이트,판테놀,스테아릴알코올,글리세릴스테아레이트시트레이트,옥틸도데칸올,하이드로제네이티드코코-글리세라이즈,카프릴릭/카프릭트라이글리세라이드,세틸알코올,부틸렌글라이콜,하이드록시프로필스타치포스페이트,베헤닐알코올,다이메티콘,토코페롤,다이스타치포스페이트,1,2-헥산다이올,페녹시에탄올,향료,카프릴릴글라이콜,소듐하이알루로네이트(0.23%),트라이소듐이디티에이,잔탄검,글리시레티닉애씨드,돌콩배아추출물,판토락톤,시트릭애씨드,펜타에리스리틸테트라-다이-t-부틸하이드록시하이드로신나메이트 [유세린 울트라 센시티브 리페어 수퍼 수르스 마스크] 정제수,부틸렌글라이콜,글리세린,다이프로필렌글라이콜,판테놀,1,2-헥산다이올,프로판다이올,하이드록시아세토페논 ,폴리솔베이트20,카보머,알지닌,펜틸렌글라이콜,알란토인,4-t-부틸사이클로헥산올,에틸헥실글리세린,하이드록시에틸셀룰로오스,다이소듐이디티에이,하이알루로닉애씨드,하이드롤라이즈드하이알루로닉애씨드,소듐하이알루로네이트,폴리솔베이트60,다이소듐포스페이트,소듐포스페이트,병풀뿌리추출물,프랑스해안송껍질추출물,병풀추출물,병풀잎추출물,아시아틱애씨드,아시아티코사이드,마데카식애씨드,마데카소사이드",True,
218,https://www.oliveyoung.co.kr/store/goods/getGoodsDetail.do?goodsNo=A000000169035&dispCatNo=100000100010014&trackingCd=Cat100000100010014_Small&t_page=카테고리관&t_click=에센스/세럼/앰플_전체__상품상세&t_number=218,"[콩 에센스] 락토바실러스/콩발효추출물, 락토바실러스/석류발효추출물, 효모/보리씨발효추출물, 락토바실러스/배즙발효여과물 [미니 순디 병풀 에센스] 정제수,부틸렌글라이콜, 병풀추출물 100,000ppm",True,
219,https://www.oliveyoung.co.kr/store/goods/getGoodsDetail.do?goodsNo=A000000200604&dispCatNo=100000100010014&trackingCd=Cat100000100010014_Small&t_page=카테고리관&t_click=에센스/세럼/앰플_전체__상품상세&t_number=219,"정제수 글리세린 다이메티콘 아이소세틸스테아레이트 나이아신아마이드 아이소프로필라우로일사코시네이트 실리카 암모늄폴리아크릴로일다이메틸타우레이트 쌀전분 석류과피추출물 포타슘세틸포스페이트 솔비탄올리에이트 징크피씨에이 글리세릴스테아레이트에스이 아이소헥사데칸 소듐하이드록사이드 미리스틸미리스테이트 2-올레아미도-1,3-옥타데칸다이올 만노오스 폴록사머338 카프릴로일살리실릭애씨드 카프릴릴글라이콜 비트레오스실라발효물 시트릭애씨드 트라이소듐에틸렌다이아민다이석시네이트 말토덱스트린 잔탄검 펜틸렌글라이콜 폴리솔베이트80 아크릴아마이드/소듐아크릴로일다이메틸타우레이트코폴리머 살리실릭애씨드 피록톤올아민 향료",True,
220,https://www.oliveyoung.co.kr/store/goods/getGoodsDetail.do?goodsNo=A000000233771&dispCatNo=100000100010014&trackingCd=Cat100000100010014_Small&t_page=카테고리관&t_click=에센스/세럼/앰플_전체__상품상세&t_number=220,"""정제수, 부틸렌글라이콜, 글리세린, 1,2-헥산다이올, 소듐아크릴레이트크로스폴리머-2, 황해쑥잎수(10,554 ppm), 자일리톨, 다이에톡시에틸석시네이트, 아이소펜틸다이올, 피피지-13 -데실테트라데세스-24, 암모늄아크릴로일다이메틸타우레이트/베헤네스-25메타크라일레이트 크로스폴리머, 베타인, 스핑고모나스발효추출물, 세라마이드엔피, 아라키딜알코올, 에틸헥실 글리세린, 향료, 스테아릭애씨드, 피토스테롤, 베헤닐알코올, 아라키딜글루코사이드, 소듐메타 포스페이트, 하이드로제네이티드레시틴, 알지닌, 아스파틱애씨드, 글루타믹애씨드, 하이알루로닉 애씨드(100 ppm), 이노시톨, 세테아릴알코올, 락토바실러스발효물, 말토덱스트린, 하이드롤 라이즈드치자추출물, 프로필렌글라이콜, 소듐하이알루로네이트(1.5 ppm), 토코페롤""",True,
221,https://www.oliveyoung.co.kr/store/goods/getGoodsDetail.do?goodsNo=A000000186864&dispCatNo=100000100010014&trackingCd=Cat100000100010014_Small&t_page=카테고리관&t_click=에센스/세럼/앰플_전체__상품상세&t_number=221,아스코빅 애씨드,True,
222,https://www.oliveyoung.co.kr/store/goods/getGoodsDetail.do?goodsNo=A000000202453&dispCatNo=100000100010014&trackingCd=Cat100000100010014_Small&t_page=카테고리관&t_click=에센스/세럼/앰플_전체__상품상세&t_number=222,"정제수, 부틸렌글라이콜, 나이아신아마이드, 프로판다이올, 2,3-부탄다이올, 1,2-헥산다이올, 글리세린, 아이소펜틸다이올, 판테놀, 레몬밤꽃/잎/줄기수*, 로즈마리잎수*, 타임잎추출물*, 유칼립투스잎추출물*, 폴스애플민트잎추출물*, 로즈힙열매추출물*, 베타인, 아스코빅애씨드, 글루타티온, 폴리글리세릴-10스테아레이트, 폴리글리세릴-10올리에이트, 효모발효여과물, 겨우살이추출물, 락토바실러스/콩발효추출물, 알란토인, 트레할로오스, 띠뿌리추출물, 암모늄폴리아크릴로일다이메틸타우레이트, 잔탄검, 카보머, 소듐글루코네이트, 피브이엠/엠에이코폴리머, 소듐시트레이트, 소듐하이알루로네이트, 트로메타민, 시트릭애씨드, 하이드롤라이즈드옥수수전분, 수크로오스, 락틱애씨드, 오렌지껍질오일+, 라임전초오일+, 센티드제라늄꽃오일+, 로즈마리잎오일+, 리모넨, 시트로넬올, 제라니올, 시트랄, 리날룰 *표시: belif original formula +표시: 식물 유래 향",True,
