product_id,product_url,ingredients,ok,error
671,https://www.oliveyoung.co.kr/store/goods/getGoodsDetail.do?goodsNo=A000000229221&dispCatNo=100000100010014&trackingCd=Cat100000100010014_Small&t_page=카테고리관&t_click=에센스/세럼/앰플_전체__상품상세&t_number=671,정제수 비피다발효용해물 글리세린 펜틸렌글라이콜 다이메티콘 부틸렌글라이콜 옥틸도데칸올 만노오스 소듐하이알루로네이트 하이드록시아세토페논 카프릴릴글라이콜 암모늄폴리아크릴로일다이메틸타우레이트 알파-글루칸올리고사카라이드 다이포타슘글리시리제이트 테트라소듐글루타메이트다이아세테이트 효모추출물 소듐카복시메틸베타-글루칸 아데노신 잔탄검 야콘뿌리즙 소듐벤조에이트 말토덱스트린 시트릭애씨드 아세틱애씨드 락틱애씨드 향료 살리실로일피토스핑고신 락토바실러스,True,
672,https://www.oliveyoung.co.kr/store/goods/getGoodsDetail.do?goodsNo=A000000229225&dispCatNo=100000100010014&trackingCd=Cat100000100010014_Small&t_page=카테고리관&t_click=에센스/세럼/앰플_전체__상품상세&t_number=672,"정제수, 변성알코올, 온천수*, 폴리글리세릴-4카프레이트, 1,2-헥산다이올, 다이글리세린, 글라이콜릭애씨드, 말릭애씨드, 락틱애씨드, 프로판다이올, 소듐하이드록사이드, 잔탄검, 부틸렌글라이콜, 향료, 피토스핑고신, 펜틸렌글라이콜, 징크락테이트, 아시아티코사이드, 스클레로튬검, 알진, 서양톱풀추출물, 창과감초뿌리추출물, 람노오스, 글루코오스, 글루쿠로닉애씨드 *50,000ppm",True,
673,https://www.oliveyoung.co.kr/store/goods/getGoodsDetail.do?goodsNo=A000000229350&dispCatNo=100000100010014&trackingCd=Cat100000100010014_Small&t_page=카테고리관&t_click=에센스/세럼/앰플_전체__상품상세&t_number=673,"정제수, 프로판다이올, 글리세린, 글리세레스-26, C13-16아이소알케인, 나이아신아마이드, 펜틸렌글라이콜, 달팽이점액여과물(17,550ppm), 스쿠알 란, 1,2-헥산다이올, 헵틸운데실레네이트, 폴리글리세릴-3다이스테아레이트, 부틸렌글라이콜, 글리세릴스테아레이트, 베타인, 다이메틸 아이소소바이드, 하이드로제네이티드폴리데센, 하이드로제네이티드폴리아이소부텐, 운데케인, 하이드로제네이티드폴리(C6-14올레핀), 아크릴레이트/C10-30알킬아크릴레이트크로스폴리머, 하이드로제네이티드레시틴, 트라이데케인, 향료, 하이드록시아세토페논, 카프릴 릭/카프릭트라이글리세라이드, 마카다미아씨오일, 참마뿌리추출물, 합성플루오르플로고파이트, 맥아추출물, 토코페롤, 레티놀(0.1%), 세틸팔 미테이트, 하이드로제네이티드올리브오일불검화물, 코코-카프릴레이트/카프레이트, 레티닐팔미테이트, 트로메타민, 잔탄검, 솔비탄올 리베이트, 솔비탄팔미테이트, 하이드롤라이즈드옥수수전분, 유채스테롤, 포스파티딜콜린, 하이드록시피나콜론레티노에이트(500ppm), 글리세릴 스테아레이트시트레이트, 아데노신, 베타-글루칸, 콜레스테롤, 한련초추출물, 아이비고드열매추출물, 다이소듐이디티에이, 폴리글리세 릴-4카프레이트, 폴리글리세릴-6카프릴레이트, 소듐폴리아크릴레이트, 수크로오스, 펜타에리스리틸테트라-다이-t-부틸하이드록시하이 드로신나메이트, 알루미늄/마그네슘하이드록사이드스테아레이트, 바이오사카라이드검-1, 폴리에터-1, 콜라겐아미노산(12ppm), 에틸헥실글리세린, 알란토인, 트리스(테트라메틸하이드록시피페리딘올)시트레이트, 글리세릴올리에이트, 라우릴글루코사이드, 폴리글리세릴-6라우레 이트, 미리스틸글루코사이드, 옥틸도데칸올, 하이드롤라이즈드하이알루로닉애씨드, 류코노스톡/무발효여과물, 글라이코리피드, 레티닐 프로피오네이트, 하이드록시데실유비퀴논, 페룰릭애씨드, 팔미토일펜타펩타이드-4",True,
674,https://www.oliveyoung.co.kr/store/goods/getGoodsDetail.do?goodsNo=A000000229422&dispCatNo=100000100010014&trackingCd=Cat100000100010014_Small&t_page=카테고리관&t_click=에센스/세럼/앰플_전체__상품상세&t_number=674,"정제수, 나이아신아마이드, 프로판다이올, 부틸렌글라이콜, 1,2-헥산다이올, 알파-알부틴, 글리세린, 에칠아스코빌에텔, 비타민나무수, 글루타티온(100ppm), 구아바열매추출물(100ppm), 소듐하이알루로네이트, 아데노신, 병풀잎추출물, 판테놀, 알란토인, 마데카소사이드, 아시아티코사이드, 토코페롤, 하이드로제네이티드레시틴, 펜틸렌글라이콜, 글리세릴폴리메타크릴레이트, 폴리글리세릴-10라우레이트, 아크릴레이트/C10-30알킬아크릴레이트크로스폴리머, 트로메타민, 하이드롤라이즈드스클레로튬검, 에틸헥실글리세린, 사이아노코발아민, 잔탄검, 클레리오일, 필리핀오렌지껍질오일, 광곽향오일, 리모넨",True,
675,https://www.oliveyoung.co.kr/store/goods/getGoodsDetail.do?goodsNo=A000000229464&dispCatNo=100000100010014&trackingCd=Cat100000100010014_Small&t_page=카테고리관&t_click=에센스/세럼/앰플_전체__상품상세&t_number=675,"정제수,메틸프로판다이올,글리세린,카프릴릭/카프릭트라이글리세라이드,다이프로필렌글라이콜,1,2-헥산다이올,나이아신아마이드,메틸글루세스-20,베타인,펜틸렌글라이콜,다시마추출물,한련초잎추출물,실버위드추출물,귀리커넬추출물,아티초크잎추출물,인도멀구슬나무잎추출물,인도멀구슬나무꽃추출물,아이비고드열매추출물,가지열매추출물,알로에베라꽃추출물,울금뿌리추출물,참산호말추출물,홀리바질잎추출물,하이드로제네이티드레시틴,녹차수,소듐하이알루로네이트,호호바씨오일,옥틸도데세스-16,카보머,트로메타민,잔탄검,에틸헥실글리세린,부틸렌글라이콜,구아검,베타-글루칸,아데노신,폴리쿼터늄-51,아가,다이소듐이디티에이,프룩토올리고사카라이드,락토바실러스,소듐하이알루로네이트크로스폴리머,하이드롤라이즈드하이알루로닉애씨드,판테놀,자일로오스,폴리글루타믹애씨드,토코페롤,글라이코리피드,프로판다이올,다이메틸실란올하이알루로네이트,하이드롤라이즈드소듐하이알루로네이트,포타슘하이알루로네이트,하이알루로닉애씨드,하이드록시프로필트라이모늄하이알루로네이트,소듐하이알루로네이트다이메틸실란올,소듐아세틸레이티드하이알루로네이트,리솔레시틴,수크로오스다이스테아레이트,트레할로오스,글리세릴스테아레이트,세테아릴알코올,하이드록시프로필사이클로덱스트린,세라마이드엔피,스테아릭애씨드,콜레스테롤,테트라아세틸피토스핑고신,글라이코스핑고리피드,세라마이드에이피,향료",True,
676,https://www.oliveyoung.co.kr/store/goods/getGoodsDetail.do?goodsNo=A000000229502&dispCatNo=100000100010014&trackingCd=Cat100000100010014_Small&t_page=카테고리관&t_click=에센스/세럼/앰플_전체__상품상세&t_number=676,"정제수,글리세린,소듐락테이트,다시마추출물,한련초잎추출물,1,2-헥산다이올,글루코노락톤,메틸프로판다이올,나이아신아마이드,빌베리열매추출물,사탕수수추출물,레몬추출물,오렌지추출물,인도멀구슬나무잎추출물,인도멀구슬나무꽃추출물,울금뿌리추출물,설탕단풍추출물,홀리바질잎추출물,당근추출물,참산호말추출물,하이드로제네이티드레시틴,소듐하이알루로네이트,다이페닐다이메티콘,판테놀,하이드록시에틸아크릴레이트/소듐아크릴로일다이메틸타우레이트코폴리머,폴리아크릴레이트크로스폴리머-6,트라이에틸헥사노인,솔비탄아이소스테아레이트,스쿠알란,폴리글리세릴-3메틸글루코오스다이스테아레이트,글라이콜릭애씨드,하이드록시프로필스타치포스페이트,시트릭애씨드,폴리글리세릴-10올리에이트,에틸헥실글리세린,프룩토올리고사카라이드,피브이피,락틱애씨드,베타-글루칸,폴리솔베이트60,아데노신,다이소듐이디티에이,하이드롤라이즈드하이알루로닉애씨드,사이아노코발아민,3-O-에틸아스코빅애씨드,자일리톨,폴리솔베이트20,레티놀,비에이치티,비에이치에이,향료,살리실릭애씨드",True,
677,https://www.oliveyoung.co.kr/store/goods/getGoodsDetail.do?goodsNo=A000000229503&dispCatNo=100000100010014&trackingCd=Cat100000100010014_Small&t_page=카테고리관&t_click=에센스/세럼/앰플_전체__상품상세&t_number=677,"정제수, 콜라겐추출물(5%), 글리세린, 소듐락테이트, 수용성콜라겐(2.5%), 하이드롤라이즈드콜라겐(2.4%), 다시마추출물, 한련초잎추출물, 1,2-헥산다이올, 글루코노락톤, 나이아신아마이드, 메틸프로판다이올, 빌베리열매추출물, 다이페닐다이메티콘, 사탕수수추출물, 레몬추출물, 오렌지추출물, 인도멀구슬나무잎추출물, 설탕단풍추출물, 인도멀구슬나무꽃추출물, 아이비고드열매추출물, 가지열매추출물, 알로에베라꽃추출물, 홀리바질잎추출물, 울금뿌리추출물, 참산호말추출물, 하이드로제네이티드레시틴, 라벤더오일, 라벤더꽃수, 트라이에틸헥사노인, 판테놀, 하이드록시에틸아크릴레이트/소듐아크릴로일다이메틸타우레이트코폴리머, 폴리아크릴레이트크로스폴리머-6, 솔비탄아이소스테아레이트, 식물성스쿠알란, 폴리글리세릴-3메틸글루코오스다이스테아레이트, 글라이콜릭애씨드, 하이드록시프로필스타치포스페이트, 시트릭애씨드, 소듐살리실레이트, 폴리글리세릴-10올리에이트, 프룩토올리고사카라이드, 락틱애씨드, 베타-글루칸, 아데노신, 살리실릭애씨드, 다이소듐이디티에이, 하이드롤라이즈드하이알루로닉애씨드, t-부틸알코올, 사이아노코발아민, 부틸렌글라이콜, 콜라겐아미노산(0.5ppm), 콜라겐(0.4ppm), 류코노스톡/무발효여과물, 하이드롤라이즈드엘라스틴, 펜타에리스리틸테트라아이소스테아레이트, 노나펩타이드-1, 아세틸헥사펩타이드-8, 카퍼트라이펩타이드-1, 트라이펩타이드-1, 팔미토일테트라펩타이드-7, 팔미토일트라이펩타이드-1, 팔미토일펜타펩타이드-4, 헥사펩타이드-9, 소듐콘드로이틴설페이트, 실리카다이메틸실릴레이트, 아텔로콜라겐(0.3ppb), 폴리솔베이트60, 에틸헥실글리세린, 카프릴릴글라이콜, 펜틸렌글라이콜, 리날룰",True,
678,https://www.oliveyoung.co.kr/store/goods/getGoodsDetail.do?goodsNo=A000000229522&dispCatNo=100000100010014&trackingCd=Cat100000100010014_Small&t_page=카테고리관&t_click=에센스/세럼/앰플_전체__상품상세&t_number=678,"토마토수(680,000 ppm), 정제수, 부틸렌글라이콜, 글리세린, 자일리톨, 1,2-헥산다이올, 다이프로필렌글라이콜, 나이아신아마이드, 니코틴아마이드모노뉴클레오타이드(10,000 ppm), 트레할로오스, 잔탄검, 카보머, 페닐트라이메티콘, 트로메타민, 알란토인, C12-13알케스-9, 폴리메틸실세스퀴옥세인, 소듐시트레이트, 에틸헥실글리세린, 잇꽃꽃추출물, 메틸다이하이드로자스모네이트, 다이포타슘글리시리제이트, 아데노신, 다이소듐이디티에이, 치자추출물, 덱스트린, 토마토추출물(200 ppm), 에틸렌브라실레이트, 글루코노락톤, 판테놀, 2-t-부틸사이클로헥실아세테이트, 칡뿌리추출물, 달맞이꽃꽃추출물, 대왕소나무잎추출물, 당느릅나무뿌리추출물, 피브로넥틴, 니코틴아마이드아데닌다이뉴클레오타이드, 소듐하이알루로네이트, 아데노신트라이포스페이트, 하이드로제네이티드레시틴, 하이드롤라이즈드하이알루로닉애씨드, 하이알루로닉애씨드, 소듐하이알루로네이트크로스폴리머, 하이드록시프로필트라이모늄하이알루로네이트, 하이드로제네이티드폴리아이소부텐, 벤질글라이콜, 세라마이드엔피, 토코페롤, 하이드롤라이즈드엘라스틴, 폴리글리세릴-10라우레이트, 데이지꽃추출물, 수용성프로테오글리칸, 유채스테롤, 토마토즙(0.1 ppm), 토마토열매/잎/줄기추출물(0.1 ppm), 페네틸알코올, 하이드롤라이즈드콜라겐, 라즈베리케톤, 피토스테릴/베헤닐/옥틸도데실라우로일글루타메이트, 콜레스테롤, 라이소레시틴, 올레익애씨드, 글라이코사미노글리칸, 소듐클로라이드, 포타슘포스페이트, 포타슘클로라이드, 다이소듐포스페이트, 하이드롤라이즈드식물성단백질, 지모뿌리추출물, 라이코펜, 콜라겐추출물, 리날릴아세테이트, 에틸리날룰, 유칼립톨, 메틸렌다이옥시페닐메틸프로판알, 헥세닐아세테이트, 2,4-다이메틸-3-사이클로헥신카복스알데하이드, 3-헥센올",True,
679,https://www.oliveyoung.co.kr/store/goods/getGoodsDetail.do?goodsNo=A000000229523&dispCatNo=100000100010014&trackingCd=Cat100000100010014_Small&t_page=카테고리관&t_click=에센스/세럼/앰플_전체__상품상세&t_number=679,"포도수(821,000 ppm), 프로판다이올, 1, 2-헥산다이올, 정제수, 나이아신아마이드, 카프릴 릭/카프릭트라이글리세라이드, 트라넥사믹애씨드, 부틸렌글라이콜, 아크릴레이트/C10-30알킬아크 릴레이트크로스폴리머, 트로메타민, 인도멀구슬나 무꽃추출물, 잔탄검, 아이비고드열매추출물, 3-O에틸아스코빅애씨드(500 ppm), 하이드로제네이 티드폴리(C6-20올레핀), 아데노신, 포도추출물(35 0 ppm), 다이소듐이디티에이, 알란토인, 에이치디 아이/트라이메틸올헥실락톤크로스폴리머, 포도씨 오일(10 ppm), 콜라겐, 류코노스톡/무발효여과물, 비치스트로베리추출물, 로우스위트블루베리추출물, 소듐하이알루로네이트, 베어베리잎추출물, 서양산 딸기추출물, 시트릭애씨드, 라벤더꽃추출물, 레스 베라트롤, 보리지추출물, 수레국화꽃추출물, 클레 리추출물, 히아신스전초추출물, 마트리카리아꽃추 출물, 백미꽃추출물, 마데카소사이드, 아시아티코 사이드, 에틸헥실글리세린, 하이알루로닉애씨드, 하이드롤라이즈드하이알루로닉애씨드, 하이드록 시프로필트라이모늄하이알루로네이트, 하이드롤 라이즈드소듐하이알루로네이트, 포타슘하이알루 로네이트, 펜틸렌글라이콜, 마데카식애씨드, 소듐 하이알루로네이트크로스폴리머, 아시아틱애씨드, 소듐아세틸레이티드하이알루로네이트",True,
680,https://www.oliveyoung.co.kr/store/goods/getGoodsDetail.do?goodsNo=A000000229597&dispCatNo=100000100010014&trackingCd=Cat100000100010014_Small&t_page=카테고리관&t_click=에센스/세럼/앰플_전체__상품상세&t_number=680,"정제수, 프로판다이올, 변성알코올, 나이아신아마이드, 부틸렌글라이콜, 글리세린, 1,2-헥산다이올, 글리세레스-26, 코튼열매수, 다이프로필렌글라이콜, 하이드록시아세토페논, 카보머, 글리세레스-25피씨에이아이소스테아레이트, 맥아추출물, 여주열매추출물, 트로메타민, 셀룰로오스검, 접시꽃추출물, 다이메티콘, 무궁화나무껍질추출물, 에틸헥실글리세린, 아데노신, 소듐글리세로포스페이트, 글리세릴아크릴레이트/아크릴릭애씨드코폴리머, 하이드로제네이티드레시틴, 포타슘마그네슘아스파테이트, 다이소듐이디티에이, 칼슘글루코네이트(120ppm), 마그네슘글루코네이트, 수크로오스팔미테이트, 카카오씨추출물, 하이알루로닉애씨드, 하이드롤라이즈드하이알루로닉애씨드, 폴리글루타믹애씨드, 소듐하이알루로네이트, 덱스트린, 스위트아몬드열매추출물, 흰목이버섯추출물, 타히보껍질추출물, 콜라겐추출물, 하이드롤라이즈드엘라스틴",True,
681,https://www.oliveyoung.co.kr/store/goods/getGoodsDetail.do?goodsNo=A000000229644&dispCatNo=100000100010014&trackingCd=Cat100000100010014_Small&t_page=카테고리관&t_click=에센스/세럼/앰플_전체__상품상세&t_number=681,"정제수, 부틸렌글라이콜, 나이아신아마이드, 글리세린, 하이드로제네이티드폴리데센, 다이프로필렌글라이콜, 옥틸도데칸올, 프로판다이올, 1,2-헥산다이올, 락토바실러스발효물, 세테아릴올리베이트, 하이드록시아세토페논, 솔비탄올리베이트, 카보머, 트로메타민, 아이비고드열매추출물, 한련초추출물, 펜틸렌글라이콜, 에틸헥실글리세린, 아크릴레이트/C10-30알킬아크릴레이트크로스폴리머, 아데노신, 비파나무잎추출물, 다이소듐이디티에이, 마데카소사이드, 인도멀구슬나무꽃추출물, 홀리바질잎추출물, 데실글루코사이드, 서인도체리열매추출물, 스피어민트추출물, 티옥틱애씨드, 인도멀구슬나무잎추출물, 판테놀, 카프릴릴글라이콜, 울금뿌리추출물, 참산호말추출물, 소듐하이알루로네이트, 하이알루로닉애씨드, 하이드롤라이즈드하이알루로닉애씨드, 카프릴릭/카프릭트라이글리세라이드, 하이드로제네이티드레시틴, 니코틴아마이드모노뉴클레오타이드, 헤스페리딘, 아스코빅애씨드, 브로멜라인, 에피갈로카테킨갈레이트, 글루타티온, 토코페롤, 해바라기씨오일, 비타민나무열매추출물, 폴리글리세릴-10올리에이트, 소듐디엔에이, 아세틸헥사펩타이드-8, 하이드록시데실유비퀴논",True,
682,https://www.oliveyoung.co.kr/store/goods/getGoodsDetail.do?goodsNo=A000000229789&dispCatNo=100000100010014&trackingCd=Cat100000100010014_Small&t_page=카테고리관&t_click=에센스/세럼/앰플_전체__상품상세&t_number=682,"정제수,탄제린추출물,부틸렌글라이콜,나이아신아마이드,다이프로필렌글라이콜,메틸글루세스-20,1,2-헥산다이올,글리세레스-26,암모늄아크릴로일다이메틸타우레이트/브이피코폴리머,판테놀,아이리쉬모스추출물,글리세린,콜레스-24,사탕수수추출물,카보머,트로메타민,폴리글리세릴-10라우레이트,에틸헥실글리세린,소듐하이알루로네이트,알란토인,아데노신,토코페릴아세테이트,하이드로제네이티드레시틴,하이드롤라이즈드호호바에스터,소듐파이테이트,잔탄검,인도멀구슬나무꽃추출물,홀리바질잎추출물,베르가모트오일,인도멀구슬나무잎추출물,아스코빌글루코사이드,다이포타슘글리시리제이트,울금뿌리추출물,참산호말추출물,라벤더오일,아스코빅애씨드,레몬껍질오일,오렌지껍질오일,유칼립투스잎추출물,일랑일랑꽃오일,3-O-에틸아스코빅애씨드,소듐아스코빌포스페이트,감초뿌리추출물,마데카소사이드,녹차추출물,말토덱스트린,스키산드라 스페난테라열매추출물,캐모마일꽃추출물,토코페롤,로즈마리잎추출물,아시아티코사이드,호장근뿌리추출물,병풀잎추출물,하이드록시프로필사이클로덱스트린,병풀추출물,흰목이버섯추출물,글루타티온,포타슘하이드록사이드,티옥틱애씨드,다이소듐이디티에이,유비퀴논,리모넨,리날룰",True,
683,https://www.oliveyoung.co.kr/store/goods/getGoodsDetail.do?goodsNo=A000000229951&dispCatNo=100000100010014&trackingCd=Cat100000100010014_Small&t_page=카테고리관&t_click=에센스/세럼/앰플_전체__상품상세&t_number=683,"정제수, 프로필렌글라이콜, 폴리솔베이트20, 쐐기풀잎추출물, 펜틸렌글라이콜, 글리세린, 에틸헥실글리세린, 부틸렌글라이콜, 소듐시트레이트, 시트릭애씨드, 다이메틸페네틸아세테이트, 페녹시에탄올, 테트라메틸아세틸옥타하이드로나프탈렌, 벤질살리실레이트, 향료",True,
